{
  "generated_at": "2026-10-05T00:00:00Z",
  "judge_model": "mock-judge",
  "n_code": 50,
  "n_style": 20,
  "blends": [
    {
      "blend_id": "sweep_000",
      "code_pass": 0.20,
      "style_score": 8.0,
      "style_score_std": 0.5,
      "rhyme_score": 0.60,
      "tokens_per_sec": 20.0
    },
    {
      "blend_id": "sweep_025",
      "code_pass": 0.28,
      "style_score": 7.2,
      "style_score_std": 0.5,
      "rhyme_score": 0.50,
      "tokens_per_sec": 19.5
    },
    {
      "blend_id": "sweep_050",
      "code_pass": 0.42,
      "style_score": 6.8,
      "style_score_std": 0.4,
      "rhyme_score": 0.31,
      "tokens_per_sec": 18.5
    },
    {
      "blend_id": "sweep_075",
      "code_pass": 0.55,
      "style_score": 5.5,
      "style_score_std": 0.6,
      "rhyme_score": 0.20,
      "tokens_per_sec": 18.0
    },
    {
      "blend_id": "sweep_100",
      "code_pass": 0.65,
      "style_score": 4.5,
      "style_score_std": 0.7,
      "rhyme_score": 0.15,
      "tokens_per_sec": 17.5
    },
    {
      "blend_id": "split_attn_code",
      "code_pass": 0.60,
      "style_score": 6.5,
      "style_score_std": 0.4,
      "rhyme_score": 0.35,
      "tokens_per_sec": 18.0
    },
    {
      "blend_id": "split_mlp_code",
      "code_pass": 0.50,
      "style_score": 7.0,
      "style_score_std": 0.5,
      "rhyme_score": 0.40,
      "tokens_per_sec": 18.2
    },
    {
      "blend_id": "gradient_mid",
      "code_pass": 0.48,
      "style_score": 6.2,
      "style_score_std": 0.6,
      "rhyme_score": 0.28,
      "tokens_per_sec": 18.1
    }
  ],
  "reference": {
    "name": "mock-big-model",
    "code_pass": 0.81,
    "style_score": 8.4
  }
}
